,index,rating,caption,middle,reviews
107,156,1.0,"(Translated by Google) Status added, sent this Saturday Until the one who ordered later arrived …"," Status added, sent this Saturday Until the one who ordered later arrived …"," Status added, sent this Saturday Until the one who ordered later arrived …"
108,157,1.0,"(Translated by Google) Meet the fresh, Tulip Squre branch. Take a table for the customer to wrap and fill in the details at the front of the outside door. Allow the customer to wrap the item. Fill in the sun to disinfect the covid 19 …"," Meet the fresh, Tulip Squre branch. Take a table for the customer to wrap and fill in the details at the front of the outside door. Allow the customer to wrap the item. Fill in the sun to disinfect the covid 19 …"," Meet the fresh, Tulip Squre branch. Take a table for the customer to wrap and fill in the details at the front of the outside door. Allow the customer to wrap the item. Fill in the sun to disinfect the covid 19 …"
109,158,1.0,"(Translated by Google) So bad Delivery from 7 today. Day 11 has not been received. Can not call any agency Plus looks at the Bangkok warehouse for 3 days, still in the same place. Went to ask at Bang Kadi warehouse to tell the company that …"," So bad Delivery from 7 today. Day 11 has not been received. Can not call any agency Plus looks at the Bangkok warehouse for 3 days, still in the same place. Went to ask at Bang Kadi warehouse to tell the company that …"," So bad Delivery from 7 today. Day 11 has not been received. Can not call any agency Plus looks at the Bangkok warehouse for 3 days, still in the same place. Went to ask at Bang Kadi warehouse to tell the company that …"
110,159,1.0,(Translated by Google) Delivery is very slow  (Original) ส่งของช้ามาก, Delivery is very slow  (Original, Delivery is very slow  
111,160,1.0,(Translated by Google) Contact did not deliver as late as the worst week.  (Original) …, Contact did not deliver as late as the worst week.  (Original, Contact did not deliver as late as the worst week.  
112,161,1.0,"(Translated by Google) Kerry Sikhio Shipping Department Terrible Service Items shipped from March 30 until April 1, but have not been delivered to customers. Call and cut the call. Callcenter can only accept the matter. Cannot solve any …"," Kerry Sikhio Shipping Department Terrible Service Items shipped from March 30 until April 1, but have not been delivered to customers. Call and cut the call. Callcenter can only accept the matter. Cannot solve any …"," Kerry Sikhio Shipping Department Terrible Service Items shipped from March 30 until April 1, but have not been delivered to customers. Call and cut the call. Callcenter can only accept the matter. Cannot solve any …"
113,166,5.0,(Translated by Google) Good service  (Original) บริการดีคับ, Good service  (Original, Good service  
114,167,5.0,Best service,,Best service
115,168,3.0,"(Translated by Google) Kerry, the most expensive to transport together  (Original) …"," Kerry, the most expensive to transport together  (Original"," Kerry, the most expensive to transport together  "
116,169,1.0,"(Translated by Google) Suck, do not call to inform you that you will be sent. Put the goods in front of the house. Will you put it to the dog for a period? …"," Suck, do not call to inform you that you will be sent. Put the goods in front of the house. Will you put it to the dog for a period? …"," Suck, do not call to inform you that you will be sent. Put the goods in front of the house. Will you put it to the dog for a period? …"
117,171,1.0,"(Translated by Google) The delivery is very slow, the Thai postage is sometimes faster than when the holidays are reduced during the 3-4 day lazada price reduction. So, pay for the expensive delivery. …"," The delivery is very slow, the Thai postage is sometimes faster than when the holidays are reduced during the 3-4 day lazada price reduction. So, pay for the expensive delivery. …"," The delivery is very slow, the Thai postage is sometimes faster than when the holidays are reduced during the 3-4 day lazada price reduction. So, pay for the expensive delivery. …"
118,175,4.0,(Translated by Google) Fast service Staff intend to provide very good service.  (Original) …, Fast service Staff intend to provide very good service.  (Original, Fast service Staff intend to provide very good service.  
119,178,5.0,"(Translated by Google) To use the service frequently, convenient to use  (Original) …"," To use the service frequently, convenient to use  (Original"," To use the service frequently, convenient to use  "
120,179,5.0,"(Translated by Google) Good work, good fun  (Original) ดีคับ งานสนุกดี"," Good work, good fun  (Original"," Good work, good fun  "
121,181,1.0,Better to use Thai Post or Alpha or other. Kerry is not safe.,,Better to use Thai Post or Alpha or other. Kerry is not safe.
122,184,5.0,"(Translated by Google) Very good service, fast, staff help with the package. And very good advice There are 2 branches with no extensions. …"," Very good service, fast, staff help with the package. And very good advice There are 2 branches with no extensions. …"," Very good service, fast, staff help with the package. And very good advice There are 2 branches with no extensions. …"
123,187,5.0,(Translated by Google) do not tell  (Original) ไม่บอก, do not tell  (Original, do not tell  
124,188,1.0,(Translated by Google) Worst shipping company in the world  (Original) …, Worst shipping company in the world  (Original, Worst shipping company in the world  
125,192,2.0,"(Translated by Google) Long wait, slow service, no parking  (Original) รอนาน บริการช้า ไม่มีที่จอดรถ"," Long wait, slow service, no parking  (Original"," Long wait, slow service, no parking  "
126,195,4.0,(Translated by Google) very good service  (Original) บริการดีมากๆ, very good service  (Original, very good service  
127,198,5.0,"(Translated by Google) Good service, convenient transportation, near bts Taksin  (Original) …"," Good service, convenient transportation, near bts Taksin  (Original"," Good service, convenient transportation, near bts Taksin  "
128,199,2.0,You pay a very high price but the delivery is very slow!,,You pay a very high price but the delivery is very slow!
129,201,1.0,I booked on the app and was given a 2 hour pickup window. I got a phone call saying they will arrive after that window. Then they asked me how many piecesm again and again and again. Then I canceled the pickup and they kept calling asking …,,I booked on the app and was given a 2 hour pickup window. I got a phone call saying they will arrive after that window. Then they asked me how many piecesm again and again and again. Then I canceled the pickup and they kept calling asking …
130,202,5.0,(Translated by Google) Good company  (Original) บริษัทที่ดี, Good company  (Original, Good company  
131,203,4.0,(Translated by Google) Is the office Not receiving parcels  (Original) …, Is the office Not receiving parcels  (Original, Is the office Not receiving parcels  
