,index,rating,caption,middle,reviews
0,1,1.0,(Translated by Google) Very slow delivery Long-standing warehouse  (Original) …, Very slow delivery Long-standing warehouse  (Original, Very slow delivery Long-standing warehouse  
1,3,1.0,"(Translated by Google) delivery man The form hasn't shipped yet, but the work is closed. Sign in that the customer receives the item. even though I haven't received this Calling can not be contacted. What is it? The service is very bad. …"," delivery man The form hasn't shipped yet, but the work is closed. Sign in that the customer receives the item. even though I haven't received this Calling can not be contacted. What is it? The service is very bad. …"," delivery man The form hasn't shipped yet, but the work is closed. Sign in that the customer receives the item. even though I haven't received this Calling can not be contacted. What is it? The service is very bad. …"
2,4,5.0,"(Translated by Google) Very good service, friendly to the people 👏🏻👏🏻👏🏻👏🏻 …"," Very good service, friendly to the people 👏🏻👏🏻👏🏻👏🏻 …"," Very good service, friendly to the people 👏🏻👏🏻👏🏻👏🏻 …"
3,5,1.0,เราส่งของตั้งแต่วันที่14/02/65จน24/02/65ก็ยังไม่ใด้รับไ.ม่มีการโทรหาหรือตีกลับไดๆหายเข้ากลีบเมฆไปเลยแย่สุดๆคือพนักงานคีระบบผิดพลาดรหัสผิดไม่รับผิดชอบไดๆไม่โทรหาไดๆทั้งสิ้น สส,,เราส่งของตั้งแต่วันที่14/02/65จน24/02/65ก็ยังไม่ใด้รับไ.ม่มีการโทรหาหรือตีกลับไดๆหายเข้ากลีบเมฆไปเลยแย่สุดๆคือพนักงานคีระบบผิดพลาดรหัสผิดไม่รับผิดชอบไดๆไม่โทรหาไดๆทั้งสิ้น สส
4,6,1.0,(Translated by Google) The delivery person is very bad habit. Order the total amount. The total amount is only 409 baht. But the sender thinks 509? How much? You shouldn't be a delivery person. It's ugly. Don't act as a delivery person. …, The delivery person is very bad habit. Order the total amount. The total amount is only 409 baht. But the sender thinks 509? How much? You shouldn't be a delivery person. It's ugly. Don't act as a delivery person. …, The delivery person is very bad habit. Order the total amount. The total amount is only 409 baht. But the sender thinks 509? How much? You shouldn't be a delivery person. It's ugly. Don't act as a delivery person. …
5,8,1.0,"(Translated by Google) The service fee is very expensive. very light water box The size of the box is as small as an ant. It's 65 baht. Other places don't exceed 30 baht. It's a lot and the profit is unreasonable. That time, the screen …"," The service fee is very expensive. very light water box The size of the box is as small as an ant. It's 65 baht. Other places don't exceed 30 baht. It's a lot and the profit is unreasonable. That time, the screen …"," The service fee is very expensive. very light water box The size of the box is as small as an ant. It's 65 baht. Other places don't exceed 30 baht. It's a lot and the profit is unreasonable. That time, the screen …"
6,10,1.0,"(Translated by Google) Kerry, why can't I check the parcel and tell the recipient to contact me? even though no one called Mine has been sent for the 3rd round. I ordered from the 4th of Feb. …"," Kerry, why can't I check the parcel and tell the recipient to contact me? even though no one called Mine has been sent for the 3rd round. I ordered from the 4th of Feb. …"," Kerry, why can't I check the parcel and tell the recipient to contact me? even though no one called Mine has been sent for the 3rd round. I ordered from the 4th of Feb. …"
7,11,1.0,"(Translated by Google) The parcel arrived broken, almost every box, as if intentionally like this, I can't take it. …"," The parcel arrived broken, almost every box, as if intentionally like this, I can't take it. …"," The parcel arrived broken, almost every box, as if intentionally like this, I can't take it. …"
8,12,1.0,"(Translated by Google) The incident happened just a moment ago, a Kerry employee came to send Pampers. We are adopting a child, the mother of the child transferred the money to me yesterday. When this employee came to send me, he acted in a …"," The incident happened just a moment ago, a Kerry employee came to send Pampers. We are adopting a child, the mother of the child transferred the money to me yesterday. When this employee came to send me, he acted in a …"," The incident happened just a moment ago, a Kerry employee came to send Pampers. We are adopting a child, the mother of the child transferred the money to me yesterday. When this employee came to send me, he acted in a …"
9,13,1.0,"(Translated by Google) If the destination is not collected, it will be very slow. Waiting to pick up since morning, still haven't arrived. But online check is riding a motorcycle. We are trying to pay the expensive shipping fee, it's very …"," If the destination is not collected, it will be very slow. Waiting to pick up since morning, still haven't arrived. But online check is riding a motorcycle. We are trying to pay the expensive shipping fee, it's very …"," If the destination is not collected, it will be very slow. Waiting to pick up since morning, still haven't arrived. But online check is riding a motorcycle. We are trying to pay the expensive shipping fee, it's very …"
10,14,1.0,"(Translated by Google) Why is Kerry so bad? A friend sent the item from 7 Jan. The product will arrive on Jan 10, but now Jan 12, the item hasn't been received yet. Called to check and was told that the address was written wrong. But really …"," Why is Kerry so bad? A friend sent the item from 7 Jan. The product will arrive on Jan 10, but now Jan 12, the item hasn't been received yet. Called to check and was told that the address was written wrong. But really …"," Why is Kerry so bad? A friend sent the item from 7 Jan. The product will arrive on Jan 10, but now Jan 12, the item hasn't been received yet. Called to check and was told that the address was written wrong. But really …"
11,15,5.0,Quiet and quality coffee.,,Quiet and quality coffee.
12,16,1.0,"(Translated by Google) Lat Krabang area, delivery is very slow, can't compete with other transport, the management is so weak!!!! …"," Lat Krabang area, delivery is very slow, can't compete with other transport, the management is so weak!!!! …"," Lat Krabang area, delivery is very slow, can't compete with other transport, the management is so weak!!!! …"
13,18,4.0,"(Translated by Google) Can be used to a certain extent, easy to park, not many people, wide, clean, the staff is okay. …"," Can be used to a certain extent, easy to park, not many people, wide, clean, the staff is okay. …"," Can be used to a certain extent, easy to park, not many people, wide, clean, the staff is okay. …"
14,19,1.0,"(Translated by Google) Kerry Khao Chamao Branch doesn't speak well. Go pick up items at the branch where no one is interested in customers even though there are many people living together. When I go to pick up the stuff, I say that the …"," Kerry Khao Chamao Branch doesn't speak well. Go pick up items at the branch where no one is interested in customers even though there are many people living together. When I go to pick up the stuff, I say that the …"," Kerry Khao Chamao Branch doesn't speak well. Go pick up items at the branch where no one is interested in customers even though there are many people living together. When I go to pick up the stuff, I say that the …"
15,20,1.0,"(Translated by Google) Very bad, Khao Chamao Branch, Rayong Province, we went to pick up the stuff. At the branch, employees are not interested. But call us to pick up the stuff. When we don't know where the stuff is, we tell them to send …"," Very bad, Khao Chamao Branch, Rayong Province, we went to pick up the stuff. At the branch, employees are not interested. But call us to pick up the stuff. When we don't know where the stuff is, we tell them to send …"," Very bad, Khao Chamao Branch, Rayong Province, we went to pick up the stuff. At the branch, employees are not interested. But call us to pick up the stuff. When we don't know where the stuff is, we tell them to send …"
16,22,1.0,"(Translated by Google) Don't do this job. Kerry had no map accuracy at all. Always come to deliver products, come in hundreds of times, but have to call and ask for directions every time, every three or four times …"," Don't do this job. Kerry had no map accuracy at all. Always come to deliver products, come in hundreds of times, but have to call and ask for directions every time, every three or four times …"," Don't do this job. Kerry had no map accuracy at all. Always come to deliver products, come in hundreds of times, but have to call and ask for directions every time, every three or four times …"
17,23,1.0,"(Translated by Google) Jingko doesn't want stars, if they don't give, they can't review anymore. If the item hasn't arrived yet, the customer doesn't have to call and waste time waiting. When calling, the items will be delivered to you to …"," Jingko doesn't want stars, if they don't give, they can't review anymore. If the item hasn't arrived yet, the customer doesn't have to call and waste time waiting. When calling, the items will be delivered to you to …"," Jingko doesn't want stars, if they don't give, they can't review anymore. If the item hasn't arrived yet, the customer doesn't have to call and waste time waiting. When calling, the items will be delivered to you to …"
18,24,3.0,(Translated by Google) wait so long  (Original) รอนานมาก, wait so long  (Original, wait so long  
19,25,5.0,(Translated by Google) Kerry branch near Bangrak market Park the car at the Chao Phraya Tower and go to the parking ticket stamp at Kerry went to deliver the documents today. I just know that now there is a …, Kerry branch near Bangrak market Park the car at the Chao Phraya Tower and go to the parking ticket stamp at Kerry went to deliver the documents today. I just know that now there is a …, Kerry branch near Bangrak market Park the car at the Chao Phraya Tower and go to the parking ticket stamp at Kerry went to deliver the documents today. I just know that now there is a …
20,26,1.0,(Translated by Google) very bad  (Original) สงของแย่มากพูดก๊ไม่ดี, very bad  (Original, very bad  
21,29,5.0,(Translated by Google) Very good service.  (Original) บริการดีมากครับ., Very good service.  (Original, Very good service.  
22,30,1.0,"(Translated by Google) Meet the delivery person at Bangkapi District Ramkhamhaeng doesn't speak well, so he speaks bluntly to his customers. met many times Can't beat the person who sent the flash. …"," Meet the delivery person at Bangkapi District Ramkhamhaeng doesn't speak well, so he speaks bluntly to his customers. met many times Can't beat the person who sent the flash. …"," Meet the delivery person at Bangkapi District Ramkhamhaeng doesn't speak well, so he speaks bluntly to his customers. met many times Can't beat the person who sent the flash. …"
23,31,1.0,(Translated by Google) You don't have to go to work with Kerry. because of being scolded by regular customers I cursed because The sender is a foreigner. Send the item to Thailand. Enter the correct name. The customer's phone number is …, You don't have to go to work with Kerry. because of being scolded by regular customers I cursed because The sender is a foreigner. Send the item to Thailand. Enter the correct name. The customer's phone number is …, You don't have to go to work with Kerry. because of being scolded by regular customers I cursed because The sender is a foreigner. Send the item to Thailand. Enter the correct name. The customer's phone number is …
24,32,5.0,(Translated by Google) Fast and convenient transportation well packaged equipment good mannered staff …, Fast and convenient transportation well packaged equipment good mannered staff …, Fast and convenient transportation well packaged equipment good mannered staff …
25,33,5.0,(Translated by Google) The only person who trusts to send a speedy disaster  (Original) เจ้าเดียวที่ไว้ใจส่งไวปบอยภัย, The only person who trusts to send a speedy disaster  (Original, The only person who trusts to send a speedy disaster  
26,37,4.0,(Translated by Google) Ok  (Original) ก็เครนะ, Ok  (Original, Ok  
27,39,1.0,(Translated by Google) waiting since morning Said I'd send the item today (I don't know when I'll send it to you) really sucks …, waiting since morning Said I'd send the item today (I don't know when I'll send it to you, waiting since morning Said I'd send the item today 
28,41,1.0,(Translated by Google) Call center staff provide very good service. But what makes the company look bad is Poor freight forwarders work like… Be aware that transport workers who are inattentive to work You're the one who puts the blame on …, Call center staff provide very good service. But what makes the company look bad is Poor freight forwarders work like… Be aware that transport workers who are inattentive to work You're the one who puts the blame on …, Call center staff provide very good service. But what makes the company look bad is Poor freight forwarders work like… Be aware that transport workers who are inattentive to work You're the one who puts the blame on …
29,44,1.0,"(Translated by Google) Why is it that when packing and delivering things, I always ask what's inside? …"," Why is it that when packing and delivering things, I always ask what's inside? …"," Why is it that when packing and delivering things, I always ask what's inside? …"
30,45,1.0,(Translated by Google) Green Dream man wearing glasses I drive very badly. …, Green Dream man wearing glasses I drive very badly. …, Green Dream man wearing glasses I drive very badly. …
31,48,1.0,(Translated by Google) Samaedam inventory is not working or not. I haven't sent items. Set girls 18/8/64 until today 22/8/64 items. I haven't sent a call to the call center. They told me to hurry up. I can't see it. I will send it. I will …, Samaedam inventory is not working or not. I haven't sent items. Set girls 18/8/64 until today 22/8/64 items. I haven't sent a call to the call center. They told me to hurry up. I can't see it. I will send it. I will …, Samaedam inventory is not working or not. I haven't sent items. Set girls 18/8/64 until today 22/8/64 items. I haven't sent a call to the call center. They told me to hurry up. I can't see it. I will send it. I will …
32,51,1.0,"(Translated by Google) Terrible, slow delivery, not available, it's closed.  (Original) …"," Terrible, slow delivery, not available, it's closed.  (Original"," Terrible, slow delivery, not available, it's closed.  "
33,54,1.0,"(Translated by Google) Very difficult to contact, call 1217 Pick it up and hang up Can't contact Delivery is very slow. Call any number but leave a message and receive it. Hang up immediately. …"," Very difficult to contact, call 1217 Pick it up and hang up Can't contact Delivery is very slow. Call any number but leave a message and receive it. Hang up immediately. …"," Very difficult to contact, call 1217 Pick it up and hang up Can't contact Delivery is very slow. Call any number but leave a message and receive it. Hang up immediately. …"
34,55,1.0,"(Translated by Google) Lots of lottery services, call to coordinate, no one answers the phone. I don't know if the management has looked at the reviews. that customers have scolded me irresponsible …"," Lots of lottery services, call to coordinate, no one answers the phone. I don't know if the management has looked at the reviews. that customers have scolded me irresponsible …"," Lots of lottery services, call to coordinate, no one answers the phone. I don't know if the management has looked at the reviews. that customers have scolded me irresponsible …"
35,56,1.0,(Translated by Google) Call to ask if the items have been delivered from the branch or not. staff can't answer Are you crazy 😥😥😥😥😥 …, Call to ask if the items have been delivered from the branch or not. staff can't answer Are you crazy 😥😥😥😥😥 …, Call to ask if the items have been delivered from the branch or not. staff can't answer Are you crazy 😥😥😥😥😥 …
36,57,1.0,"(Translated by Google) Why it sucks, Kerry Fireworks, the rotten stuff doesn't deliver in the system. It says the phone number is not correct. Why does it take so long to deliver? Summary of rotten items and not delivered. …"," Why it sucks, Kerry Fireworks, the rotten stuff doesn't deliver in the system. It says the phone number is not correct. Why does it take so long to deliver? Summary of rotten items and not delivered. …"," Why it sucks, Kerry Fireworks, the rotten stuff doesn't deliver in the system. It says the phone number is not correct. Why does it take so long to deliver? Summary of rotten items and not delivered. …"
37,58,1.0,"(Translated by Google) Very bad service, delivery from Mae Sot on the 4th, arrived in Bangkok on the 9th at 3pm. It's rotten, bamboo shoots. …"," Very bad service, delivery from Mae Sot on the 4th, arrived in Bangkok on the 9th at 3pm. It's rotten, bamboo shoots. …"," Very bad service, delivery from Mae Sot on the 4th, arrived in Bangkok on the 9th at 3pm. It's rotten, bamboo shoots. …"
38,61,1.0,(Translated by Google) What is the call center for cats? Called and no one picked up... The delivery man works very hard. …, What is the call center for cats? Called and no one picked up... The delivery man works very hard. …, What is the call center for cats? Called and no one picked up... The delivery man works very hard. …
39,62,1.0,"(Translated by Google) It's so bad, it's still like this  (Original) …"," It's so bad, it's still like this  (Original"," It's so bad, it's still like this  "
40,63,1.0,(Translated by Google) Very bad. Sent items on the 29th day. I haven't arrived yet. I don't know what to do. …, Very bad. Sent items on the 29th day. I haven't arrived yet. I don't know what to do. …, Very bad. Sent items on the 29th day. I haven't arrived yet. I don't know what to do. …
41,64,1.0,"(Translated by Google) Very bad, called to come to me since July 1st. In the morning, I will come to send to you in the evening. I haven't received items until today. On the 2nd day, I still haven't received it yet. …"," Very bad, called to come to me since July 1st. In the morning, I will come to send to you in the evening. I haven't received items until today. On the 2nd day, I still haven't received it yet. …"," Very bad, called to come to me since July 1st. In the morning, I will come to send to you in the evening. I haven't received items until today. On the 2nd day, I still haven't received it yet. …"
42,65,1.0,"(Translated by Google) I saw that the PTT branch, Amphawa Phra Hai, valued in millions. The owner sent 28 boxes of amulets. But someone came to cancel the bill without asking for a card or any evidence. …"," I saw that the PTT branch, Amphawa Phra Hai, valued in millions. The owner sent 28 boxes of amulets. But someone came to cancel the bill without asking for a card or any evidence. …"," I saw that the PTT branch, Amphawa Phra Hai, valued in millions. The owner sent 28 boxes of amulets. But someone came to cancel the bill without asking for a card or any evidence. …"
43,66,1.0,"(Translated by Google) 1. Your company's work is very irresponsible since 1.1 Recording only 10 digit phone numbers, you still record wrongly and also blame customers for not matching numbers. even though Kerry was the one who made …"," 1. Your company's work is very irresponsible since 1.1 Recording only 10 digit phone numbers, you still record wrongly and also blame customers for not matching numbers. even though Kerry was the one who made …"," 1. Your company's work is very irresponsible since 1.1 Recording only 10 digit phone numbers, you still record wrongly and also blame customers for not matching numbers. even though Kerry was the one who made …"
44,68,4.0,"(Translated by Google) of the week and it hasn't arrived yet If you can't send it, don't pick it up. …"," of the week and it hasn't arrived yet If you can't send it, don't pick it up. …"," of the week and it hasn't arrived yet If you can't send it, don't pick it up. …"
45,69,1.0,(Translated by Google) Kerry employee came to pick up the product from today 22 July '21 and lost the product. Contacted the employee to inform that the claim has been sent. Call the subject to inform that the officer will call back. From 6 …, Kerry employee came to pick up the product from today 22 July '21 and lost the product. Contacted the employee to inform that the claim has been sent. Call the subject to inform that the officer will call back. From 6 …, Kerry employee came to pick up the product from today 22 July '21 and lost the product. Contacted the employee to inform that the claim has been sent. Call the subject to inform that the officer will call back. From 6 …
46,70,2.0,"(Translated by Google) Who told Kerry the service is good and fast, send the item back, it takes 4 days, plus the shipping fee is expensive. …"," Who told Kerry the service is good and fast, send the item back, it takes 4 days, plus the shipping fee is expensive. …"," Who told Kerry the service is good and fast, send the item back, it takes 4 days, plus the shipping fee is expensive. …"
47,71,1.0,"(Translated by Google) How big do you have to be? The box is broken. secretly change the box And the stuff inside is this messy But there is no call to notify, but can send SMS saying that the claim is difficult to claim. The employee threw …"," How big do you have to be? The box is broken. secretly change the box And the stuff inside is this messy But there is no call to notify, but can send SMS saying that the claim is difficult to claim. The employee threw …"," How big do you have to be? The box is broken. secretly change the box And the stuff inside is this messy But there is no call to notify, but can send SMS saying that the claim is difficult to claim. The employee threw …"
48,72,5.0,"(Translated by Google) The delivery point of Kerry Bangrak branch is in front of the Chao Phraya Building, but Kerry's head office is located on the Chao Phraya Building behind Robinson Bangrak. …"," The delivery point of Kerry Bangrak branch is in front of the Chao Phraya Building, but Kerry's head office is located on the Chao Phraya Building behind Robinson Bangrak. …"," The delivery point of Kerry Bangrak branch is in front of the Chao Phraya Building, but Kerry's head office is located on the Chao Phraya Building behind Robinson Bangrak. …"
49,74,1.0,"(Translated by Google) Ordered and wanted to return the product. because the product does not match the order Contact the office to check where the product came from. because we send it as cash on delivery In fact, the head office must have …"," Ordered and wanted to return the product. because the product does not match the order Contact the office to check where the product came from. because we send it as cash on delivery In fact, the head office must have …"," Ordered and wanted to return the product. because the product does not match the order Contact the office to check where the product came from. because we send it as cash on delivery In fact, the head office must have …"
50,77,1.0,"Extremely slow delivery. Our parcel arrived at the final distribution depot and then took 4 days to be delivered - walking to collect the parcel at the depot would have been 8 times faster than Kerry's ""express"" service. …",,"Extremely slow delivery. Our parcel arrived at the final distribution depot and then took 4 days to be delivered - walking to collect the parcel at the depot would have been 8 times faster than Kerry's ""express"" service. …"
51,78,1.0,"(Translated by Google) Don't let the stars send items from Samut Prakan. Come to Ram Inthra. Send on 30 Nov. July 64 until today 2 June. Year 64 I haven't received it, but it's been delivered for 2 days. We wait to receive it. Going out far …"," Don't let the stars send items from Samut Prakan. Come to Ram Inthra. Send on 30 Nov. July 64 until today 2 June. Year 64 I haven't received it, but it's been delivered for 2 days. We wait to receive it. Going out far …"," Don't let the stars send items from Samut Prakan. Come to Ram Inthra. Send on 30 Nov. July 64 until today 2 June. Year 64 I haven't received it, but it's been delivered for 2 days. We wait to receive it. Going out far …"
52,79,1.0,(Translated by Google) The location is not the same as the picture. Other companies didn't take it for next time …, The location is not the same as the picture. Other companies didn't take it for next time …, The location is not the same as the picture. Other companies didn't take it for next time …
