,index,rating,caption,middle,reviews
53,80,1.0,"(Translated by Google) Did not send the item and pressed in the app randomly saying that the recipient cannot be contacted, that is, if you want to do this Close the company. Let's go. If management can't manage people, it sucks. …"," Did not send the item and pressed in the app randomly saying that the recipient cannot be contacted, that is, if you want to do this Close the company. Let's go. If management can't manage people, it sucks. …"," Did not send the item and pressed in the app randomly saying that the recipient cannot be contacted, that is, if you want to do this Close the company. Let's go. If management can't manage people, it sucks. …"
54,82,1.0,"(Translated by Google) I would like to ask, what is the purpose of doing service business? Please help me find a question that says that I can't send documents, copies of national ID cards via transport. Call to the office and talk to the …"," I would like to ask, what is the purpose of doing service business? Please help me find a question that says that I can't send documents, copies of national ID cards via transport. Call to the office and talk to the …"," I would like to ask, what is the purpose of doing service business? Please help me find a question that says that I can't send documents, copies of national ID cards via transport. Call to the office and talk to the …"
55,84,1.0,"(Translated by Google) The delivery staff let us go out to pick up things in front of the alley. Tell the dog that the dog is afraid that the dog is afraid to send it. What is it? Another company, he has never seen it bite anyone. post …"," The delivery staff let us go out to pick up things in front of the alley. Tell the dog that the dog is afraid that the dog is afraid to send it. What is it? Another company, he has never seen it bite anyone. post …"," The delivery staff let us go out to pick up things in front of the alley. Tell the dog that the dog is afraid that the dog is afraid to send it. What is it? Another company, he has never seen it bite anyone. post …"
56,85,1.0,"(Translated by Google) Mother sent the item since the 13th day, the 17th, and has not received the item, is very confused, call 1271, about 10 more per line, top up, call 100 baht until the money runs out, it still does not receive. …"," Mother sent the item since the 13th day, the 17th, and has not received the item, is very confused, call 1271, about 10 more per line, top up, call 100 baht until the money runs out, it still does not receive. …"," Mother sent the item since the 13th day, the 17th, and has not received the item, is very confused, call 1271, about 10 more per line, top up, call 100 baht until the money runs out, it still does not receive. …"
57,86,1.0,"(Translated by Google) Terrible, delivery 11/5/64, said it will arrive in Pattaya on the 13th, this one has not arrived yet, check the status in the same place for 3 days, ask who thrown to each other. There are no other channels to contact …"," Terrible, delivery 11/5/64, said it will arrive in Pattaya on the 13th, this one has not arrived yet, check the status in the same place for 3 days, ask who thrown to each other. There are no other channels to contact …"," Terrible, delivery 11/5/64, said it will arrive in Pattaya on the 13th, this one has not arrived yet, check the status in the same place for 3 days, ask who thrown to each other. There are no other channels to contact …"
58,87,1.0,"(Translated by Google) How can the heel of the product be preserved? Calling the call center, I am completely suspicious. How can I claim that I cannot contact the recipient? …"," How can the heel of the product be preserved? Calling the call center, I am completely suspicious. How can I claim that I cannot contact the recipient? …"," How can the heel of the product be preserved? Calling the call center, I am completely suspicious. How can I claim that I cannot contact the recipient? …"
59,88,1.0,"(Translated by Google) Pathum Branch Clerk Write the correct address Except postal code The delivery staff called to ask and informed them. No one contacted Check the status, it says Waiting to verify the correct address from the sender / …"," Pathum Branch Clerk Write the correct address Except postal code The delivery staff called to ask and informed them. No one contacted Check the status, it says Waiting to verify the correct address from the sender / …"," Pathum Branch Clerk Write the correct address Except postal code The delivery staff called to ask and informed them. No one contacted Check the status, it says Waiting to verify the correct address from the sender / …"
60,89,1.0,"(Translated by Google) 3 days of not yet arrived Food is just rotten And tell me to send as well Up in the system that the employee is delivering, this has been 3 days and sucks, the call center number does not call. …"," 3 days of not yet arrived Food is just rotten And tell me to send as well Up in the system that the employee is delivering, this has been 3 days and sucks, the call center number does not call. …"," 3 days of not yet arrived Food is just rotten And tell me to send as well Up in the system that the employee is delivering, this has been 3 days and sucks, the call center number does not call. …"
61,90,1.0,"(Translated by Google) So bad, waste of money, urgent delivery Will be on the 3rd day and have not yet sent the item to proceed to check the status of in Photharam What are you going to do in different ways? Don't you check the delivery …"," So bad, waste of money, urgent delivery Will be on the 3rd day and have not yet sent the item to proceed to check the status of in Photharam What are you going to do in different ways? Don't you check the delivery …"," So bad, waste of money, urgent delivery Will be on the 3rd day and have not yet sent the item to proceed to check the status of in Photharam What are you going to do in different ways? Don't you check the delivery …"
62,91,1.0,"(Translated by Google) Very bad. During this time, the delivery was delayed, not as scheduled. There was no notification at all. Called and waited for the last hour before talking. Bad to everything Trust me all this time, I hate each …"," Very bad. During this time, the delivery was delayed, not as scheduled. There was no notification at all. Called and waited for the last hour before talking. Bad to everything Trust me all this time, I hate each …"," Very bad. During this time, the delivery was delayed, not as scheduled. There was no notification at all. Called and waited for the last hour before talking. Bad to everything Trust me all this time, I hate each …"
63,92,5.0,"(Translated by Google) I went to deliver the goods early in the morning, so I used the Rabbit points. Redeem 50 baht for delivery fee and pay with Rabbit at Kerry, very nice 😘 …"," I went to deliver the goods early in the morning, so I used the Rabbit points. Redeem 50 baht for delivery fee and pay with Rabbit at Kerry, very nice 😘 …"," I went to deliver the goods early in the morning, so I used the Rabbit points. Redeem 50 baht for delivery fee and pay with Rabbit at Kerry, very nice 😘 …"
64,93,1.0,"(Translated by Google) Very bad, our box is damaged, the jack gave us a new one, but took a lot of ours. Our items are not very complete. …"," Very bad, our box is damaged, the jack gave us a new one, but took a lot of ours. Our items are not very complete. …"," Very bad, our box is damaged, the jack gave us a new one, but took a lot of ours. Our items are not very complete. …"
65,94,1.0,Don’t call it Live Chat when it comes with AI. They can not answer me any questions I want to know. It’s useless,,Don’t call it Live Chat when it comes with AI. They can not answer me any questions I want to know. It’s useless
66,95,1.0,(Translated by Google) Running is very slow compared to other transport. Suggest shops to change to a new bus station …, Running is very slow compared to other transport. Suggest shops to change to a new bus station …, Running is very slow compared to other transport. Suggest shops to change to a new bus station …
67,96,1.0,"(Translated by Google) Wait for fresh fruit to send status. Employees are coming and sending since 19 until 20 shift has passed and no one has contacted yet. Probably rot in the box, maybe? …"," Wait for fresh fruit to send status. Employees are coming and sending since 19 until 20 shift has passed and no one has contacted yet. Probably rot in the box, maybe? …"," Wait for fresh fruit to send status. Employees are coming and sending since 19 until 20 shift has passed and no one has contacted yet. Probably rot in the box, maybe? …"
68,97,1.0,"(Translated by Google) Terrible staff Make an appointment to go send But not going now, not calling to inform …"," Terrible staff Make an appointment to go send But not going now, not calling to inform …"," Terrible staff Make an appointment to go send But not going now, not calling to inform …"
69,102,4.0,(Translated by Google) Good service  (Original) ับริการดี, Good service  (Original, Good service  
70,103,1.0,"(Translated by Google) This company is probably the worst and in terms of shipping, if compared to J&T and Plash, the two of them are much better. The delivery itself is not cheap. I have been discontinued. Many rounds. Lose the feeling. …"," This company is probably the worst and in terms of shipping, if compared to J&T and Plash, the two of them are much better. The delivery itself is not cheap. I have been discontinued. Many rounds. Lose the feeling. …"," This company is probably the worst and in terms of shipping, if compared to J&T and Plash, the two of them are much better. The delivery itself is not cheap. I have been discontinued. Many rounds. Lose the feeling. …"
71,104,3.0,"(Translated by Google) Kerry Ban Phe, Rayong Province, close for lunch L. Need to find a place to send elsewhere …"," Kerry Ban Phe, Rayong Province, close for lunch L. Need to find a place to send elsewhere …"," Kerry Ban Phe, Rayong Province, close for lunch L. Need to find a place to send elsewhere …"
72,106,1.0,"(Translated by Google) Send fruit to Kerry Nakhon Nayok The system said it will be until March 7, 64, but it turns out that there are no employees to deliver goods to customers according to Kerry. There are a lot of products lately, causing …"," Send fruit to Kerry Nakhon Nayok The system said it will be until March 7, 64, but it turns out that there are no employees to deliver goods to customers according to Kerry. There are a lot of products lately, causing …"," Send fruit to Kerry Nakhon Nayok The system said it will be until March 7, 64, but it turns out that there are no employees to deliver goods to customers according to Kerry. There are a lot of products lately, causing …"
73,107,5.0,(Translated by Google) A more security system than an airport  (Original) ระบบความปลดภัยยิ่งกว่าสนามบิน, A more security system than an airport  (Original, A more security system than an airport  
74,109,3.0,"(Translated by Google) Okay, the first time to send.  (Original) โอเครค่ะ ครั้งแรกในการส่ง"," Okay, the first time to send.  (Original"," Okay, the first time to send.  "
75,110,1.0,"(Translated by Google) Notifying that the product will be delivered today, not waiting until late, the call will not accept this work, service or work. …"," Notifying that the product will be delivered today, not waiting until late, the call will not accept this work, service or work. …"," Notifying that the product will be delivered today, not waiting until late, the call will not accept this work, service or work. …"
76,111,1.0,"(Translated by Google) There is a product that needs to be delivered today, parcel number shp xxxxxxxxx, tracking delivery status, saying that it has been shipped. With a signature But I haven't received it yet. There are people waiting to …"," There is a product that needs to be delivered today, parcel number shp xxxxxxxxx, tracking delivery status, saying that it has been shipped. With a signature But I haven't received it yet. There are people waiting to …"," There is a product that needs to be delivered today, parcel number shp xxxxxxxxx, tracking delivery status, saying that it has been shipped. With a signature But I haven't received it yet. There are people waiting to …"
77,112,4.0,"(Translated by Google) Hello, I usually use the service of the nearest Kerry branch in Bangkok. It is always good .. But now I have to go to Pong Nam Ron, but still have to deliver the products to customers as before. Confidence in Kerry …"," Hello, I usually use the service of the nearest Kerry branch in Bangkok. It is always good .. But now I have to go to Pong Nam Ron, but still have to deliver the products to customers as before. Confidence in Kerry …"," Hello, I usually use the service of the nearest Kerry branch in Bangkok. It is always good .. But now I have to go to Pong Nam Ron, but still have to deliver the products to customers as before. Confidence in Kerry …"
78,113,1.0,"(Translated by Google) I called two rounds, the staff will follow me to wait until the evening has not yet called the staff to tell me when to send. …"," I called two rounds, the staff will follow me to wait until the evening has not yet called the staff to tell me when to send. …"," I called two rounds, the staff will follow me to wait until the evening has not yet called the staff to tell me when to send. …"
79,116,2.0,"(Translated by Google) Did not receive the item, but someone signed it. I do not know who. So why didn't the parcel call? …"," Did not receive the item, but someone signed it. I do not know who. So why didn't the parcel call? …"," Did not receive the item, but someone signed it. I do not know who. So why didn't the parcel call? …"
80,117,1.0,"(Translated by Google) Details checked That the product has arrived But the product did not see it. What do I have to do next? Sin started exporting from the 27th day. Today, day 7, and still haven't seen …"," Details checked That the product has arrived But the product did not see it. What do I have to do next? Sin started exporting from the 27th day. Today, day 7, and still haven't seen …"," Details checked That the product has arrived But the product did not see it. What do I have to do next? Sin started exporting from the 27th day. Today, day 7, and still haven't seen …"
81,118,1.0,One star because I don’t like their service today. They didn’t accept my passport picture on my phone today because they need the original one but i’ve been trying to do it many times before whenever I am sending a package. I don’t know if there’s new regulations. Educate me!!,,One star because I don’t like their service today. They didn’t accept my passport picture on my phone today because they need the original one but i’ve been trying to do it many times before whenever I am sending a package. I don’t know if there’s new regulations. Educate me!!
82,119,1.0,(Translated by Google) Terrible. Close.  (Original) ยอดแย่ ปิดไปเหอะ, Terrible. Close.  (Original, Terrible. Close.  
83,120,2.0,"(Translated by Google) The staff delivered the goods home But accidentally did not give grandmother money The staff called us to deliver the goods to our house, answered the call and asked if the money could be transferred. The staff …"," The staff delivered the goods home But accidentally did not give grandmother money The staff called us to deliver the goods to our house, answered the call and asked if the money could be transferred. The staff …"," The staff delivered the goods home But accidentally did not give grandmother money The staff called us to deliver the goods to our house, answered the call and asked if the money could be transferred. The staff …"
84,122,2.0,"(Translated by Google) Souvenirs delivered to Tak Don Chedi on January 5, 2021 Time around 15.00 Today, 6 Jan 2031 at 4 p.m. …"," Souvenirs delivered to Tak Don Chedi on January 5, 2021 Time around 15.00 Today, 6 Jan 2031 at 4 p.m. …"," Souvenirs delivered to Tak Don Chedi on January 5, 2021 Time around 15.00 Today, 6 Jan 2031 at 4 p.m. …"
85,123,1.0,(Translated by Google) Very bad service Arbitrary delay delivery Do you train staff? …, Very bad service Arbitrary delay delivery Do you train staff? …, Very bad service Arbitrary delay delivery Do you train staff? …
86,125,1.0,(Translated by Google) Date 31 December 63 The delivery staff called to ask us if we are ready to receive the product. So I replied that I wasn't ready. Because going to other provinces Therefore I would like to postpone the 4th day of …, Date 31 December 63 The delivery staff called to ask us if we are ready to receive the product. So I replied that I wasn't ready. Because going to other provinces Therefore I would like to postpone the 4th day of …, Date 31 December 63 The delivery staff called to ask us if we are ready to receive the product. So I replied that I wasn't ready. Because going to other provinces Therefore I would like to postpone the 4th day of …
87,126,1.0,"(Translated by Google) Department of labor to deliver goods, have to deliver things to the front of the house Not deposited in the village law I told many times and still do. There are 2 people, one sent to the house every time. Thank you …"," Department of labor to deliver goods, have to deliver things to the front of the house Not deposited in the village law I told many times and still do. There are 2 people, one sent to the house every time. Thank you …"," Department of labor to deliver goods, have to deliver things to the front of the house Not deposited in the village law I told many times and still do. There are 2 people, one sent to the house every time. Thank you …"
88,130,1.0,"(Translated by Google) Terrible - worst According to the parcel which is overdue In the morning, I was told that the staff would contact you back, it was silent again. More importantly, let's wait for the parcel. There is no movement what …"," Terrible - worst According to the parcel which is overdue In the morning, I was told that the staff would contact you back, it was silent again. More importantly, let's wait for the parcel. There is no movement what …"," Terrible - worst According to the parcel which is overdue In the morning, I was told that the staff would contact you back, it was silent again. More importantly, let's wait for the parcel. There is no movement what …"
89,131,1.0,"(Translated by Google) Slow delivery as a nation The service staff is terrible, the transportation is extremely bad, the more you use the service every day, the worse the service Call according to the call center, wait for the call as a …"," Slow delivery as a nation The service staff is terrible, the transportation is extremely bad, the more you use the service every day, the worse the service Call according to the call center, wait for the call as a …"," Slow delivery as a nation The service staff is terrible, the transportation is extremely bad, the more you use the service every day, the worse the service Call according to the call center, wait for the call as a …"
90,132,1.0,"(Translated by Google) Delivery from December 4 to Phuket destination. 4 days have not received the item, call, no staff to answer the call, send the parcel tracking number to Chaiyaphum, very confused. …"," Delivery from December 4 to Phuket destination. 4 days have not received the item, call, no staff to answer the call, send the parcel tracking number to Chaiyaphum, very confused. …"," Delivery from December 4 to Phuket destination. 4 days have not received the item, call, no staff to answer the call, send the parcel tracking number to Chaiyaphum, very confused. …"
91,133,1.0,"(Translated by Google) About almost 5 days, write all the details, but not complete, not responsible, call to not answer …"," About almost 5 days, write all the details, but not complete, not responsible, call to not answer …"," About almost 5 days, write all the details, but not complete, not responsible, call to not answer …"
92,134,1.0,(Translated by Google) There are no major office phone numbers and the staff answer the phone at 11am. …, There are no major office phone numbers and the staff answer the phone at 11am. …, There are no major office phone numbers and the staff answer the phone at 11am. …
93,135,4.0,(Translated by Google) Good service Quick and fast. …, Good service Quick and fast. …, Good service Quick and fast. …
94,137,1.0,"(Translated by Google) Today, I met myself, what is it for today? Very bad work. Delivery since yesterday at nine o'clock. Arrived in Bangkok at fifty and fifty customers waited all day. Call the employee's check. Tell them to call to ask. …"," Today, I met myself, what is it for today? Very bad work. Delivery since yesterday at nine o'clock. Arrived in Bangkok at fifty and fifty customers waited all day. Call the employee's check. Tell them to call to ask. …"," Today, I met myself, what is it for today? Very bad work. Delivery since yesterday at nine o'clock. Arrived in Bangkok at fifty and fifty customers waited all day. Call the employee's check. Tell them to call to ask. …"
95,139,2.0,"(Translated by Google) Curry in the latter part, poor service. (Chiang Mai) There is no call to inform the customer first, or sometimes the customer does not receive the call, it is not confirmed .. is that the doorbell called at all .. …"," Curry in the latter part, poor service. (Chiang Mai"," Curry in the latter part, poor service. "
96,141,1.0,(Translated by Google) very bad  (Original) แย่มาก, very bad  (Original, very bad  
97,142,4.0,"(Translated by Google) Let it be a table or a suitable drop-off place, not to drop it on the ground. This branch is nice, it has a table that you can reach, you can put it on the table and shoot. But have to grab the writing area for …"," Let it be a table or a suitable drop-off place, not to drop it on the ground. This branch is nice, it has a table that you can reach, you can put it on the table and shoot. But have to grab the writing area for …"," Let it be a table or a suitable drop-off place, not to drop it on the ground. This branch is nice, it has a table that you can reach, you can put it on the table and shoot. But have to grab the writing area for …"
98,143,5.0,(Translated by Google) Very good service  (Original) บริการดีมากค่ะ, Very good service  (Original, Very good service  
99,144,1.0,"(Translated by Google) If the shop sent the goods since yesterday, but went to check the number and it says no, what is this delivery? …"," If the shop sent the goods since yesterday, but went to check the number and it says no, what is this delivery? …"," If the shop sent the goods since yesterday, but went to check the number and it says no, what is this delivery? …"
100,145,1.0,"(Translated by Google) The delivery person speaks badly. To find us asking the address, we have already told him but he is not right. Instead, ranting, we should improve. If talking dog is not like this, very bad 👎👎👎👎👎👎👎 👎 …"," The delivery person speaks badly. To find us asking the address, we have already told him but he is not right. Instead, ranting, we should improve. If talking dog is not like this, very bad 👎👎👎👎👎👎👎 👎 …"," The delivery person speaks badly. To find us asking the address, we have already told him but he is not right. Instead, ranting, we should improve. If talking dog is not like this, very bad 👎👎👎👎👎👎👎 👎 …"
101,146,4.0,(Translated by Google) Good service  (Original) ให้บริการดีค่ะ, Good service  (Original, Good service  
102,147,1.0,The MOST USELESS hotline numbers!!! YOU SENT MY ENVELOPE AT THE WRONG ADDRESS! Called your hotline for a MILLION TIMES still NO FREAKIN ANSWER!,,The MOST USELESS hotline numbers!!! YOU SENT MY ENVELOPE AT THE WRONG ADDRESS! Called your hotline for a MILLION TIMES still NO FREAKIN ANSWER!
103,149,1.0,(Translated by Google) Delivery very long damaged goods Sent backboard doing 😡😡😡. …, Delivery very long damaged goods Sent backboard doing 😡😡😡. …, Delivery very long damaged goods Sent backboard doing 😡😡😡. …
104,151,5.0,(Translated by Google) Modern buildings and work spaces The staff spoke good almost everyone who has contacted. Thank you Kerry …, Modern buildings and work spaces The staff spoke good almost everyone who has contacted. Thank you Kerry …, Modern buildings and work spaces The staff spoke good almost everyone who has contacted. Thank you Kerry …
105,152,5.0,"(Translated by Google) Good service, good advice  (Original) บริการดีค่ะ ให้คำแนะนำดี"," Good service, good advice  (Original"," Good service, good advice  "
106,155,1.0,"(Translated by Google) So what? The delivery staff didn't arrive at the room, calling to tell them to walk down to pick up the goods. If the old guy came up to deliver, then he didn't have to come to work. And still going to go down to the …"," So what? The delivery staff didn't arrive at the room, calling to tell them to walk down to pick up the goods. If the old guy came up to deliver, then he didn't have to come to work. And still going to go down to the …"," So what? The delivery staff didn't arrive at the room, calling to tell them to walk down to pick up the goods. If the old guy came up to deliver, then he didn't have to come to work. And still going to go down to the …"
